Rating,Date,Title,Content,Reviewer,Verified,Brand Response,YearMonth,Country
5,2025-05-12,No Title,Tutto bene,"Eleonora, Italy",Yes,No response,2025-05,Italy
5,2025-05-12,No Title,Ottimo,"lorenzo, Italy",Yes,No response,2025-05,Italy
5,2025-05-12,No Title,Ottimo rapporto qualità prezzo,"Davide, Italy",Yes,No response,2025-05,Italy
5,2025-05-10,No Title,"Très agréable , chaud , confortable , résistant ,","CHRISTELLE, France",Yes,No response,2025-05,France
5,2025-05-09,no está mal para su precio,No está mal para el precio que tiene. Abriga lo suficiente y es cómodo de llevar,"reyes, Spain",Yes,No response,2025-05,Spain
5,2025-05-08,No Title,Muy práctica y cómoda para cargar,"William, Colombia",Yes,¡Hola William! ¡Tus comentarios son muy importantes para nosotros! ¿Sabías que nuestros productos son testeados por deportistas? esto nos permite ofrecerte artículos con la mejor calidad y adaptados a tus necesidades deportivas. Esperamos que alcances todas tus metas con tus nuevos productos Decathlon. ¡Un saludo deportivo!,2025-05,Colombia
5,2025-05-08,No Title,Pratique de bonne qualité et chaud,"Valérie, France",Yes,No response,2025-05,France
5,2025-05-08,No Title,Très très bon rapport qualité prix,"anthony, France",Yes,No response,2025-05,France
5,2025-05-07,No Title,Excelente,"Harley, Portugal",Yes,No response,2025-05,Portugal
5,2025-05-07,No Title,Value for Money,"Shrikrishna, Italy",Yes,No response,2025-05,Italy
4,2025-05-07,No Title,"This sleep bag is comfortabel and can rsist temparature min 4, perfect value for money","Shrikrishna, Italy",Yes,No response,2025-05,Italy
4,2025-05-07,No Title,"Zatím ho máme krátce, ale dobrý.","Viktor, Czechia",Yes,No response,2025-05,Czechia
5,2025-05-06,No Title,Très bon rapport qualité prix pour ce sac de couchage,"Michaël, France",Yes,No response,2025-05,France
5,2025-05-06,No Title,Très bon sac de couchage. Adapté pour le camping.,"Michaël, France",Yes,No response,2025-05,France
5,2025-05-04,No Title,Conforme à nos attentes !,"Nathalie, France",Yes,No response,2025-05,France
5,2025-05-04,No Title,Perfecto. Muy calentito y su textura es muy agradable.,"GEMA, Spain",Yes,No response,2025-05,Spain
5,2025-05-02,No Title,muito bonito e boa qualidade,"Elisabete, Portugal",Yes,No response,2025-05,Portugal
5,2025-05-02,No Title,daje radę OK,"Iwona, Poland",Yes,No response,2025-05,Poland
5,2025-05-02,No Title,Bardzo,"Oleksandr, Poland",Yes,No response,2025-05,Poland
4,2025-05-01,No Title,Très bon rapport qualité prix !,"YUKIKO, France",Yes,No response,2025-05,France
4,2025-04-30,No Title,j'utilise pour camping et autre ! il est pratique je recommande,"Virg, France",Yes,No response,2025-04,France
4,2025-04-30,No Title,bon produit je recommande,"Virg, France",Yes,No response,2025-04,France
4,2025-04-30,No Title,"Bueno para camping donde no vas a cargar mucho tiempo el equipo ya que pesa lo suyo y si hace mucho volumen en la mochila, probado a 7°C dentro de la tienda y ya estaba en el punto de pasar frio, así que tomen eso cuenta.","Raul, Mexico",Yes,No response,2025-04,Mexico
4,2025-04-29,No Title,Comodo e caldo,"Isotta, Italy",Yes,No response,2025-04,Italy
5,2025-04-28,No Title,Ras,"laurence, France",Yes,No response,2025-04,France
5,2025-04-26,No Title,Parfait pour le camping,"Cyril, France",Yes,No response,2025-04,France
5,2025-04-25,No Title,Bien,"ANNABELLE, France",Yes,No response,2025-04,France
5,2025-04-24,Comfortable and warm,"It's perfect for camping in summers in Ireland, great material, provides comfortable sleep and warm enough.","Anju, Ireland",Yes,No response,2025-04,Ireland
5,2025-04-22,Pratique,Duvet chaud et agréable avec possibilité d’assembler deux duvets identiques . Bon rapport qualité prix. Le duvet mériterait cependant d’être un peu plus compacte,"Frédéric, France",Yes,No response,2025-04,France
5,2025-04-22,No Title,tutto ok,"Irene, Italy",Yes,No response,2025-04,Italy
5,2025-04-21,ottimo,ottimi,"Gianluca, Italy",Yes,No response,2025-04,Italy
5,2025-04-20,Bien,Bon produit pour le camping,"Camille, France",Yes,No response,2025-04,France
5,2025-04-18,good,"Uso esse saco de dormir há um ano. Fiquei muito satisfeito, então comprei mais dois para meus filhos.","Oleksandra, Portugal",Yes,No response,2025-04,Portugal
5,2025-04-18,No Title,"Hài lòng về chất lượng sản phẩm, cách bán hàng, thái độ nhân viên.","Anonymous Author, Vietnam",Yes,No response,2025-04,Vietnam
5,2025-04-18,No Title,W większości śpiworów suwak nie wytrzymywał. ten jest super.,"Beata, Poland",Yes,No response,2025-04,Poland
5,2025-04-15,Super jakość duży ciepły i można łączyć,Genialny śpiwór mega ciepły duży i można go łączyć z z drugim i mamy wielką kołdrę !,"Sebastian, Poland",Yes,No response,2025-04,Poland
3,2025-04-15,No Title,"Abbastanza caldo, ma molto ingombrante","Gabriele, Italy",Yes,No response,2025-04,Italy
3,2025-04-14,No Title,Un po piccolo,"ROSANNA, Italy",Yes,No response,2025-04,Italy
3,2025-04-14,produit de qualité très moyenne,Produit chère par rapport à sa qualité,"Kamal, Morocco",Yes,"Bonjour, Merci pour votre retour. Nous sommes désolés d'apprendre que la qualité du produit n’a pas répondu à vos attentes. Votre avis est important pour nous et nous allons le transmettre à nos équipes afin d’améliorer nos produits à l'avenir. Si vous souhaitez discuter de cette expérience, n’hésitez pas à contacter notre service client. Sportivement, Douaa – Équipe Decathlon",2025-04,Morocco
5,2025-04-14,No Title,轻便型睡袋,"中国客户, China",Yes,No response,2025-04,China
3,2025-04-12,Trop petit,"Je suis un peu large d'épaule et il m' a été impossible d'y rentrer complètement et de fermer le sac. J'ai du dormir avec un bras à l'extérieur, du coup je me suis un peu gelé toute la nuit et impossible de dormir convenablement.","marc, Belgium",Yes,"Bonjour, Merci de nous avoir donné votre avis sur notre sac de couchage. Avant tout, je suis désolé d’apprendre que ce produit n’a pas pu répondre à votre besoin. Je vous invite à revenir en magasin afin que nous puissions vous proposer un échange ou un remboursement.",2025-04,Belgium
5,2025-04-12,sacco a pelo,molto utile,"Veronica, Italy",Yes,No response,2025-04,Italy
4,2025-04-11,No Title,Comfortable,"Vinay, India",Yes,No response,2025-04,India
5,2025-04-10,ottimo acquisto,"ottimo rapporto qualità prezzo, un po' ingombrante ma molto comodo","Federica, Italy",Yes,No response,2025-04,Italy
5,2025-04-10,"Dobry, podstawowy śpiwór","Używam tego śpiwora od kilku lat i nigdy nie zawiódł. oczywiście głównie przydaje się w miarę stabilnych warunkach, natomiast letnie i wiosenne chłody nie są mu straszne. Dobrze się śpi, mimo sztucznych materiałów nie pocę sie w nim, jest komfortowo. Obecnie dokupiłem drugi i można je połączyć tworząc duży dwuosobowy co uważam za ekstra funkcję.","Bartosz, Poland",Yes,No response,2025-04,Poland
5,2025-04-10,Great product,Good sleeping comfort and holds warm,"Philipp, Portugal",Yes,No response,2025-04,Portugal
5,2025-04-09,Bardzo fajna śpiwór.,Dziecko zadowolone.,"Urszula, Poland",Yes,No response,2025-04,Poland
5,2025-04-09,"Do namiotu ok, jest ciepły",Używałem na wypadach kajakowych ze spaniem pod namiotem. W ciepłe dni jak bylo chłodniej było mi w nim wystarczajaco ciepło mając gołe nogi. Mógłby być nieco mniejszy po zapakowaniu do transportu czy workow wodoszczelnych ale i tak polecam. Mysle ze w przypadku promocji gdzie cena oscyluje w okolicy stowy to mozna brac w ciemno.,"Tomek, Poland",Yes,No response,2025-04,Poland
5,2025-04-09,No Title,It's nice,"Mamta, India",Yes,No response,2025-04,India
5,2025-04-08,godny polecenia,odpowiedni dla mnie.,"Sławomir, Poland",Yes,No response,2025-04,Poland
5,2025-04-07,super opcja pod namiot,"Bardzo wygodny i uniwersalny śpiwór, można podpiąć drugi w razie czego co jest mega fajnym rozwiazaniem","Klaudia, Poland",Yes,No response,2025-04,Poland
5,2025-04-07,No Title,产品不错，值得购买。,"中国客户, China",Yes,No response,2025-04,China
4,2025-04-07,No Title,值得购买,"中国客户, China",Yes,No response,2025-04,China
4,2025-04-06,Confortable et chaud,Il fait le job. On dort bien dedans. Utilisé avec un lit de camp et le matelas gonflable « basic » de chez DKT une semaine. Utilisé l’année dernière (prêt) j’ai acheté le miens cette année.,"Pascal, France",Yes,No response,2025-04,France
5,2025-04-05,godny polecenia,"ciepły, wygodny, przyjemny w dotyku. Na plus to to że można przerobić go na kołdrę co podczas cieplejszych nocy bardzo dobrze się sprawdza. Cena a jakość na plus. Polecam.","Damian, Poland",Yes,No response,2025-04,Poland
5,2025-04-05,po prostu top,dobrze spac,"Taras, Poland",Yes,No response,2025-04,Poland
5,2025-04-04,dobry na chłodne wieczory,sprawdził się na zimne wieczory festiwalu Poland rock,"Arkadiusz, Poland",Yes,No response,2025-04,Poland
5,2025-04-04,"Podstawowy produkt, świetny stosunek ceny do jako",Podstawowy śpiwór. Spełnia swoją rolę za tę cene.,"S, Poland",Yes,No response,2025-04,Poland
5,2025-04-03,top,super confort tien bien l'acheteur du corp,"Joan, France",Yes,No response,2025-04,France
5,2025-04-02,Güzel,Sıcak ve yumuşak,"Bedirhan Dersim, Türkiye",Yes,No response,2025-04,Türkiye
5,2025-04-02,Polecam,"Bardzo fajny, ciepły śpiwór","Karolina, Poland",Yes,No response,2025-04,Poland
5,2025-04-02,Całkiem ok,Polecam,"JULIUSZ, Poland",Yes,No response,2025-04,Poland
5,2025-04-02,Polecam,Polecam,"Justyna, Poland",Yes,No response,2025-04,Poland
5,2025-04-02,Parfait pour le camping de loisir,"Léger et compact, ce sac de couchage offre une belle chaleur et un super confort pour les nuitées en camping. La couleur bleu canard est très jolie","Peggy, France",Yes,No response,2025-04,France
4,2025-04-02,No Title,尺寸比較大，但夠暖，露營使用十分足夠保暖。,"Yan Yee, Hong Kong SAR China",Yes,No response,2025-04,
5,2025-04-01,No Title,不错,"中国客户, China",Yes,No response,2025-04,China
5,2025-03-31,Einfacher Schlafsack,Top Preis Leistung,"Hugentoler, Switzerland",Yes,No response,2025-03,Switzerland
5,2025-03-31,Śpiwór,Idealny na harcerskie obozy i kolonie. Dobrze trzyma ciepło. Córki zadowolone. Polecam,"Wioletta, Poland",Yes,No response,2025-03,Poland
5,2025-03-27,recomendo,Bom produto,"Nelson, Portugal",Yes,No response,2025-03,Portugal
5,2025-03-27,Sac de couchage,sac de couchage très joli confortable et chaud. peut être un peu difficile à remettre dans sa housse de transport,"Julie, France",Yes,No response,2025-03,France
5,2025-03-27,No Title,"Vypadá dobře, splňuje očekávání","Alžběta, Czechia",Yes,No response,2025-03,Czechia
5,2025-03-26,Je recommande,"J'ai acheté ce sac de couchage pour mon fils de 17 ans qui est grand et large. L'article est parfait, assez grand, assez large, de bonne qualité, pas cher et confortable. J'en suis très contente et lui aussi.","Charlyne, France",Yes,No response,2025-03,France
5,2025-03-26,Ótima qualidade,Produto de ótima qualidade e custo benefício Recomendo,"FRANCINY, Brazil",Yes,No response,2025-03,Brazil
5,2025-03-25,Saco-cama Excelente,"Gostei imenso desta aquisição. Valeu bem a pena. O que é mais interessante ainda é comprar dois e juntá-los para criar uma espécie de cobertor-cama. Muito bom, recomendo","Joana, Portugal",Yes,No response,2025-03,Portugal
5,2025-03-25,Bardzo bobry Spiwór,"Śpiwór dobrej jakość, na plus możliwość łączenia ze sobą dwóch","Marta, Poland",Yes,No response,2025-03,Poland
5,2025-03-23,No Title,超喜欢，这样冬天睡车上不冷了,"中国客户, China",Yes,No response,2025-03,China
5,2025-03-21,Komfortowy i niezawodny śpiwór na letnie biwaki !,"Śpiwór jest świetny wyb͏ór na letnie biwaki! Jes͏t bardzo wygodny, miękki i przyjemny w dotyku co zapewnia͏ komfortowy sen pod niebem. Świetnie zrobiony, z moc͏n͏ych materiałów, gwarantuje długą żywotność. Łatwo się pakuje i n͏ie spr͏awia proble͏m w transporcie. ͏Zapewnia͏ najleps͏zą tempera͏tu͏rę͏ w ciepłe noce a jego przestronny͏ krój pozwala na swo͏bodę ruchu. Świe͏tny zwią͏zek jakości do ceny czyni to niez͏będnym czę͏ścią sprzę͏tu każdego mi͏łośnika wyc͏ieczek!","Kuba, Poland",Yes,No response,2025-03,Poland
5,2025-03-21,No Title,优惠活动力度大，质量杠杠的，很厚实，特别适合在单位午休用。,"中国客户, China",Yes,No response,2025-03,China
5,2025-03-20,Hálózsák,Ár/érték arányban kitűnő termék. Gyerekeim szeretik használni.,"Vatainé, Hungary",Yes,No response,2025-03,Hungary
3,2025-03-19,Nice,"Colour - beautiful Quality -Good. Feeling of fabric - Soft Weight -Light weight. Compatibility - It's folded size is quite big, carrying it is a headache, it doesn't fit in bag or take most of space. Waterproof - No Cover - Not Waterproof that's the biggest drawback, as one is carrying it, outside of bag and when cover is not waterproof, what would happen? A waterproof cover like a shoulder bag, must be provided with it  Tagging /label- Price tag must be on sleeping bag itself instead of its cover ! All the details printed on cover must be also printed on sleeping bag as well to avoid good up. (Please check colour and product inside & outside before buying it).","Raibhandare, India",Yes,No response,2025-03,India
5,2025-03-18,śpiwór,dobrze wykonany. nie dla osób pow 100kg,"Sebastian, Poland",Yes,No response,2025-03,Poland
5,2025-03-18,śpiwór,bardzo dobrze wykonany dzieci zadowolone. Nie dla osób powyżej 100kg,"Sebastian, Poland",Yes,No response,2025-03,Poland
4,2025-03-18,Moste 40h,.,"Žan, Slovenia",Yes,"Pozdravljeni,  Hvala, da ste si vzeli čas za oceno!  Lep pozdrav,  Ajda",2025-03,Slovenia
5,2025-03-14,Tip top!,"Sac de couchage qui fait très bien le job, mais je n'avais pas anticipé que replié, il prenait autant de place.","Clotilde, France",Yes,No response,2025-03,France
5,2025-03-11,agréable,agréable,"Dominique, France",Yes,No response,2025-03,France
5,2025-03-11,confortable,confortable,"Dominique, France",Yes,No response,2025-03,France
5,2025-03-11,Idealny dla harcerki,"Polecam, sprawdzil się idealnie w zimie podczas nocowania w szkole. Córka była bardzo zadowolona.","Jagoda, Poland",Yes,No response,2025-03,Poland
5,2025-03-10,Bon rapport qualité prix,Bon rapport qualité prix,"Rebeca, France",Yes,No response,2025-03,France
5,2025-03-10,Great product,"Great product, comfortable and easy to use. It's a bit bulky though","v, India",Yes,No response,2025-03,India
5,2025-03-10,No Title,不错不错，很舒服,"中国客户, China",Yes,No response,2025-03,China
5,2025-03-09,perfetto per una escursione primaverile.,"abbiamo apprezzato questo prodotto, ottimo per un'escursione primaverile quando le temperature notturne non sono molto fredde. inoltre unendo 2 si può ottenere un matrimoniale. veramente ottimo.","Marsel, Italy",Yes,No response,2025-03,Italy
3,2025-03-08,Coating comfort could be improved,"I like Quechua products and I have so many of them, but this one could be better","Rodrigues, Portugal",Yes,No response,2025-03,Portugal
5,2025-03-06,perfetto,"Perfetto per il campeggio, resistente e morbido. 5 stelle","vanessa, Italy",Yes,No response,2025-03,Italy
5,2025-03-05,Súper recomendable,"Encantada con la compra, compramos 2 mismo color, ventaja se pueden unir mediante cremallera","Belen, Spain",Yes,No response,2025-03,Spain
5,2025-03-04,Bon sac de couchage,"Sac de couchage que j’utilise en Roadtrips (températures qui restent raisonnables), tient bien au chaud quand les températures extérieures sont aux alentours de 5 degrés , je n’ai pas testé par moins. Le sac se lave et se range facilement","Camille, France",Yes,No response,2025-03,France
5,2025-03-04,Ciepły I funkcjonalny,Ciepły I funkcjonalny,"Adam, Poland",Yes,No response,2025-03,Poland
5,2025-03-04,Ciepły i funkcjonalny,Ciepły i funkcjonalny. Polecam,"Adam, Poland",Yes,No response,2025-03,Poland
2,2025-03-04,bad product,Not a warm sleeping bag,"Mohit, India",Yes,"Hello Mohit  Thank you for sharing your feedback with us. I'm sorry to hear that you were not satisfied with the overall quality of your purchase.  To help me better understand your concerns, could you please provide more specific details about the issues you encountered? Were there particular aspects of the product, such as the materials, construction, or fit that did not meet your expectations & why you felt so? Your insights will help us improve our products and service.  However, this sleeping bag is best suitable for 10 degree temperature.  I value your input and want to ensure I address any issues you're facing. Please let me know how I can assist you further. Looking forward to your response.  Thank you for your understanding.   Stay Fit, Stay Active VIKRAM SINGH CHAUHAN Sports Ambassador Mountain Sports",2025-03,India
4,2025-03-03,No Title,工作人员推荐的,"中国客户, China",Yes,No response,2025-03,China
5,2025-03-02,parfait,"parfait au camping comme à la maison, un sac léger et chaud","pascale, France",Yes,No response,2025-03,France
4,2025-02-28,hálózsák 10c,"meleg ,a csomagmérte nagy","Botond, Hungary",Yes,No response,2025-02,Hungary
5,2025-02-27,Good,Please deliver on time P,"R, India",Yes,No response,2025-02,India
