Rating,Date,Title,Content,Reviewer,Verified,Brand Response,YearMonth,Country
5,2022-09-26,Super,Excellent,"Youssef, Tunisia",Yes,"Bonjour monsieur, merci pour votre avis. A très bientôt dans votre magasin. Bonne journée.  Asma, Leader sport Decathlon Mall Of Sousse",2022-09,Tunisia
4,2022-09-26,Avis personnel,"Oui, c'est un bon produit","Sami, Tunisia",Yes,bonjour  Merci pour votre avis. je suis content que vous êtes satisfait.    Sportifs satisfaits c'est mon métier Meriam :),2022-09,Tunisia
4,2022-09-05,Je recommande,C'est excellent en terme de rapport qualité prix...,"Mohamed, Tunisia",Yes,"Bonjour Monsieur Mohamed ,  Je vous remercie pour votre avis et pour cette super note !C'est un plaisir de lire votre satisfaction :) Ravis de voir que nos produits vous plaisent.  Je vous souhaite une bonne journée, à bientôt dans votre décathlon  Sportivement,    Zaï  Nour ✌️   Leader Sport Equitation 🐴",2022-09,Tunisia
2,2022-09-05,.,ضربني في ساقي,"Hamdi, Tunisia",Yes,"Bonjour Ms  Tout d'abord merci pour votre avis , pouvez vous nous envoyer votre numéro de portable pour qu'on puisse vous appeler et savoir la problématique de l'article Vous pouvez faire l'echange s'il y a eu une faute de fabrication .  Sportivement .  Islem,Le Sport c'est mon Passion 💪 ""Désir,Force,Défi""",2022-09,Tunisia
4,2022-07-15,Bon produit,Idéal pour marche sur centier battus,"Wael, Tunisia",Yes,"Bonjour monsieur, merci pour votre avis. Nous sommes ravis que nos produits aient été à la hauteur de vos attentes. Vous êtes le bienvenu. Bonne journée.  Asma, Leader sport Decathlon Mall Of Sousse",2022-07,Tunisia
5,2022-07-12,Bien,Merci pour votre service,"Ahmed, Tunisia",Yes,"Bonjour Monsieur Ahmed ,  Nous vous remercions pour votre commentaire sur nos services et nous sommes ravis que votre expérience ait été agréable😊 Comme toujours, si vous êtes satisfait, nous sommes heureux de pouvoir vous satisfaire !  Mes collègues et moi-même vous souhaitons une excellente journée 😊 Sportivement,    Nour  Leader Sport Equitation",2022-07,Tunisia
5,2022-06-29,Ma satisfaction,"Franchement je suis très satisfait non seulement des achats mais aussi des agents et le service aussi,merci beaucoup Decathlon pour ce meilleur rapport qualité prix.","Bilel, Tunisia",Yes,"Bonjour Bilel  Merci pour votre avis. Je suis content que vous etes satisfait !  A la prochaine dans votre magasin decathlon Azur City  Mohamed.E Sportif, à votre service 😊",2022-06,Tunisia
4,2022-06-03,Bon,Bonne qualité,"Taha, Tunisia",Yes,"Bonjour, Merci pour votre avis. Vous êtes le bienvenu. Bonne journée.   Asma, Leader sport Decathlon Mall Of Sousse",2022-06,Tunisia
5,2022-05-27,Excellent,Excellent produit,"Moez, Tunisia",Yes,No response,2022-05,Tunisia
1,2022-05-16,Mauvaise service,Mauvais service,"Amdouni, Tunisia",Yes,"Bonjour,  Vous avez toujours la possibilité de ramener votre sac écologique, Décathlon ne vous oblige pas à acheter le sac.  Passez une bonne journée.  Khalil, Leader Sport Décathlon",2022-05,Tunisia
3,2022-05-16,Diminuer le prix s'il vous plaît,Diminuer le prix s'il vous plaît,"Abidi, Tunisia",Yes,"Bonjour M Abidi,  Je suis Mohamed Leader d'équipe à Decathlon La Marsa.  Tout d'abord je vous remercie pour votre feedback.  J'en profite de cet échange pour vous expliquer les causes de hausse de prix.  En effet, suite à la crise covid19 on a vu les prix des matières premières et de transport et logistique augmenter partout dans le monde.  En plus, on a eu des augmentations de taxes en Tunisie.  Ces facteurs ont impactés directement nos prix.  A Decathlon, nous travaillons chaque jour pour vous proposer le juste prix. C'est à dire, la meilleure offre en Tunisie en terme de rapport qualité prix et technicité.  En espérant vous revoir bientôt dans notre magasin Decathlon La Marsa.  Cdt Mohamed  MOHAMED",2022-05,Tunisia
5,2025-05-15,No Title,"È il secondo paio che acquisto e mi trovo bene e poi è le uniche poche scarpe che arrivano al numero 48, e uno come me alto 2,07 metri fa fatica a trovare scarpe e alla decathlon trovo sempre la mia taglia , grazie decathlon","Roberto, Italy",Yes,No response,2025-05,Italy
5,2025-05-15,No Title,Belle scarpe comode leggerissimi perfetto,"GIORGIO, Italy",Yes,No response,2025-05,Italy
5,2025-05-15,No Title,Çok rahat konforlu beklentiyi karşıladı,"Pervin, Türkiye",Yes,No response,2025-05,Türkiye
5,2025-05-15,No Title,Molto comode e leggere,"Paolo, Italy",Yes,No response,2025-05,Italy
5,2025-05-15,No Title,"Pratique pour la salle, chaussures souple et légère","Vincent, France",Yes,No response,2025-05,France
4,2025-05-15,No Title,"scarpa giusta per la ginnastica, leggera e pratica","Andrea maria giuseppe, Italy",Yes,No response,2025-05,Italy
5,2025-05-15,No Title,Calitate,"STEFANESCU, Romania",Yes,No response,2025-05,Romania
5,2025-05-15,No Title,Good,"Ishika, India",Yes,No response,2025-05,India
5,2025-05-15,No Title,agréables,"Daya, France",Yes,No response,2025-05,France
5,2025-05-15,No Title,Tornaórákra kiváló,"Kriszta, Hungary",Yes,No response,2025-05,Hungary
5,2025-05-15,No Title,Value for money Good quality,"Sridhar, India",Yes,No response,2025-05,India
5,2025-05-15,No Title,Light weight and comfortable...,"KETAN, India",Yes,No response,2025-05,India
5,2025-05-15,No Title,"Đẹp, đi thoải mái","Louis Nguyễn, Vietnam",Yes,No response,2025-05,Vietnam
5,2025-05-15,No Title,"Guter Schuh , sehr bequem","Michael, Germany",Yes,No response,2025-05,Germany
5,2025-05-15,No Title,Много добро съотношение цена-качество.,"Георги, Bulgaria",Yes,No response,2025-05,Bulgaria
5,2025-05-15,No Title,"10000 passi al giorno in leggerezza, sembra di volare","GIULIANO, Italy",Yes,No response,2025-05,Italy
5,2025-05-15,No Title,"Bien, légère, usage occasionnel","Karine, France",Yes,No response,2025-05,France
5,2025-05-14,Sağlam ürün,2019 dan beri kullanıyorum ve hala sağlam.,"MESUT, Türkiye",Yes,No response,2025-05,Türkiye
5,2025-05-14,ürün çok iyi,tavsiye ederim,"adem, Türkiye",Yes,No response,2025-05,Türkiye
5,2025-05-14,hafif ve rahat,fiyat performans ürünü hafif ve rahat kısa yürüyüş için ideal ikinci defa alıyorum,"Uğur, Türkiye",Yes,No response,2025-05,Türkiye
4,2025-05-14,No Title,rapporto qualità prezzo ottimo considerando che il prodotto è durevole quanto quelli di fasce di prezzo più alte. sicuramente l'estetica è molto migliorabile,"simone, Italy",Yes,No response,2025-05,Italy
4,2025-05-14,No Title,J'ai acheté car elles sont légères mais je ne cours pas.(Pour la résistance je ne me prononce pas),"Denis, France",Yes,No response,2025-05,France
5,2025-05-14,No Title,"Molto comode per le mie passeggiate, e i miei allenamenti","D, Italy",Yes,No response,2025-05,Italy
1,2025-05-14,Not comfortable,Shoes not comfortable,"Amit, India",Yes,No response,2025-05,India
5,2025-05-14,Taillent bien,Baskets confortables et taillent correctement,"Lauriane, France",Yes,No response,2025-05,France
5,2025-05-13,No Title,"È il secondo paio che prendo, il primo se lo è preso mia moglie le ha provate e le è piaciuta la leggerezza.","Roberto, Italy",Yes,No response,2025-05,Italy
5,2025-05-13,No Title,Ottimo prodotto,"Gabriela, Italy",Yes,No response,2025-05,Italy
4,2025-05-13,No Title,Good as expected,"Sumit, India",Yes,No response,2025-05,India
4,2025-05-13,No Title,Comode e rilassanti,"Luigi, Italy",Yes,No response,2025-05,Italy
5,2025-05-13,Ottime sneakers,"Le ho comprate da usare per il lavoro. Sono davvero leggerissime, il piede respira e sono comodissime","Giada, Italy",Yes,No response,2025-05,Italy
4,2025-05-13,No Title,Comfortable and lightweight,"Sumit, India",Yes,No response,2025-05,India
5,2025-05-13,ayakkabı,"çok hafif çok rahat bir ayakkabi,ayağı yormuyor keşke farklı renkleri de olsa","Emine, Türkiye",Yes,No response,2025-05,Türkiye
5,2025-05-13,No Title,Çok rahat.,"BURHAN, Türkiye",Yes,No response,2025-05,Türkiye
